{
  "schema_version": "1.0",
  "validation_id": "frdm-mcxn236-example-validation",
  "board": {
    "name": "FRDM-MCXN236",
    "physical_revision": "not-yet-recorded",
    "context_bundle_digest": "sha256:0000000000000000000000000000000000000000000000000000000000000000"
  },
  "source_artifacts": [
    {
      "source_url": "https://www.nxp.com/design/design-center/development-boards-and-designs/FRDM-MCXN236",
      "retrieved_at": "not-yet-retrieved",
      "digest": "sha256:0000000000000000000000000000000000000000000000000000000000000000",
      "license": "not-yet-reviewed"
    }
  ],
  "capture_plan": {
    "viewpoints": ["not-yet-captured"],
    "lighting": ["not-yet-captured"],
    "motion": ["not-yet-captured"],
    "occlusion": ["not-yet-captured"]
  },
  "splits": {},
  "metrics": {
    "registration": {},
    "localization": {},
    "orientation": {},
    "latency": {},
    "thermal": {}
  },
  "offline_proof": "not-yet-run",
  "limitations": ["Populated-board localization is not assembly verification."],
  "output": {
    "manifest_digest": "sha256:0000000000000000000000000000000000000000000000000000000000000000",
    "human_report_digest": "sha256:0000000000000000000000000000000000000000000000000000000000000000"
  }
}
